Specify the parasite that causes African sleeping sickness.,Plasmodium falciparum,Toxoplasma gondii,Leishmania donovani,Trypanosoma brucei,D
What organism is responsible for trichomoniasis?,Trichomonas vaginalis,Entamoeba histolytica,Toxoplasma gondii,Plasmodium falciparum,A
Identify the parasite associated with Chagas disease.,Leishmania donovani,Trypanosoma cruzi,Giardia lamblia,Plasmodium falciparum,B
Which vector primarily transmits Trypanosoma cruzi?,Sandflies,Mosquitoes,Ticks,Triatomine bugs (kissing bugs),D
What parasite causes giardiasis?,Entamoeba histolytica,Plasmodium falciparum,Trichomonas vaginalis,Giardia lamblia,D
What is the causative agent of leishmaniasis?,Entamoeba histolytica,Plasmodium falciparum,Leishmania donovani,Toxoplasma gondii,C
Identify the parasite responsible for schistosomiasis.,Toxoplasma gondii,Plasmodium falciparum,Schistosoma spp.,Entamoeba histolytica,C
How is Schistosoma spp. primarily transmitted?,Inhalation of respiratory droplets,Vector-borne transmission,Through contact with contaminated freshwater,Sexual transmission,C
What parasite causes toxoplasmosis?,Entamoeba histolytica,Trichomonas vaginalis,Plasmodium falciparum,Toxoplasma gondii,D
Specify the causative agent of lymphatic filariasis.,Entamoeba histolytica,Toxoplasma gondii,Wuchereria bancrofti,Plasmodium falciparum,C
Identify the parasite responsible for trichuriasis (whipworm infection).,Entamoeba histolytica,Plasmodium falciparum,Trichuris trichiura,Toxoplasma gondii,C
How is Trichuris trichiura primarily transmitted?,Direct contact,Through ingestion of contaminated food and water,Vector-borne transmission,Sexual transmission,B
What parasite causes visceral leishmaniasis (kala-azar)?,Toxoplasma gondii,Entamoeba histolytica,Plasmodium falciparum,Leishmania donovani,D
Specify the causative agent of African trypanosomiasis (sleeping sickness).,Trypanosoma brucei,Toxoplasma gondii,Plasmodium falciparum,Entamoeba histolytica,A
Name the parasites responsible for hookworm infection.,Entamoeba histolytica,Toxoplasma gondii,Ancylostoma duodenale and Necator americanus,Plasmodium falciparum,C
How are Ancylostoma duodenale and Necator americanus primarily transmitted?,Direct contact,Vector-borne transmission,Ingestion of contaminated food and water,Through skin penetration by larvae,D
Identify the parasite responsible for amoebic liver abscess.,Plasmodium falciparum,Entamoeba histolytica,Toxoplasma gondii,Trichomonas vaginalis,B
Which bacterium is responsible for causing tuberculosis?,Staphylococcus aureus,Mycobacterium tuberculosis,Salmonella typhi,Escherichia coli,B
Name the bacterium that causes urinary tract infections.,Staphylococcus aureus,Escherichia coli,Pseudomonas aeruginosa,Streptococcus pyogenes,B
What is the causative agent of pneumonia?,Klebsiella pneumoniae,Escherichia coli,Staphylococcus aureus,Streptococcus pneumoniae,D
Which bacterium is associated with food poisoning?,Helicobacter pylori,Escherichia coli,Salmonella enterica,Staphylococcus aureus,C
Name the bacterium responsible for causing gonorrhea.,Escherichia coli,Staphylococcus aureus,Neisseria gonorrhoeae,Streptococcus pyogenes,C
What bacterium is commonly responsible for causing skin infections?,Pseudomonas aeruginosa,Escherichia coli,Streptococcus pneumoniae,Staphylococcus aureus,D
Which bacterium is associated with causing dental caries (tooth decay)?,Streptococcus mutans,Haemophilus influenzae,Staphylococcus aureus,Escherichia coli,A
Name the bacterium responsible for causing Lyme disease.,Streptococcus pyogenes,Escherichia coli,Staphylococcus aureus,Borrelia burgdorferi,D
What is the causative agent of syphilis?,Streptococcus pneumoniae,Escherichia coli,Staphylococcus aureus,Treponema pallidum,D
Which bacterium is commonly associated with causing urinary tract stones (struvite stones)?,Staphylococcus aureus,Escherichia coli,Proteus mirabilis,Enterococcus faecalis,C
Name the bacterium responsible for causing diphtheria.,Staphylococcus aureus,Escherichia coli,Corynebacterium diphtheriae,Streptococcus pyogenes,C
What bacterium is commonly associated with causing peptic ulcers?,Escherichia coli,Staphylococcus aureus,Helicobacter pylori,Streptococcus pneumoniae,C
Which bacterium is responsible for causing meningitis in neonates?,Group B Streptococcus (Streptococcus agalactiae),Staphylococcus aureus,Streptococcus pyogenes,Escherichia coli,A
Name the bacterium commonly associated with causing wound infections.,Escherichia coli,Staphylococcus aureus,Streptococcus pneumoniae,Pseudomonas aeruginosa,B
What is the causative agent of tetanus?,Escherichia coli,Streptococcus pyogenes,Staphylococcus aureus,Clostridium tetani,D
Which bacterium is commonly associated with causing Legionnaires' disease?,Legionella pneumophila,Staphylococcus aureus,Streptococcus pneumoniae,Escherichia coli,A
Name the bacterium responsible for causing whooping cough.,Bordetella pertussis,Streptococcus pyogenes,Escherichia coli,Staphylococcus aureus,A
What bacterium is commonly associated with causing dental abscesses?,Streptococcus intermedius,Streptococcus pneumoniae,Escherichia coli,Staphylococcus aureus,D
Which bacterium is responsible for causing leprosy?,Streptococcus pyogenes,Mycobacterium leprae,Escherichia coli,Staphylococcus aureus,B
Name the bacterium commonly associated with causing pneumonia in cystic fibrosis patients.,Staphylococcus aureus,Streptococcus pneumoniae,Escherichia coli,Pseudomonas aeruginosa,D
Which microorganism is responsible for causing candidiasis (yeast infection)?,Aspergillus fumigatus,Candida albicans,Escherichia coli,Staphylococcus aureus,B
Name the microorganism commonly associated with causing urinary tract infections in catheterized patients.,Staphylococcus aureus,Streptococcus pyogenes,Pseudomonas aeruginosa,Escherichia coli,D
What is the causative agent of infectious mononucleosis (glandular fever)?,Epstein-Barr virus (EBV),Streptococcus pneumoniae,Escherichia coli,Staphylococcus aureus,A
Which microorganism is commonly associated with causing pneumonia in patients with cystic fibrosis?,Escherichia coli,Staphylococcus aureus,Pseudomonas aeruginosa,Streptococcus pneumoniae,C
Name the microorganism responsible for causing sexually transmitted infection (STI) syphilis.,Staphylococcus aureus,Escherichia coli,Streptococcus pneumoniae,Treponema pallidum,D
What microorganism is commonly associated with causing food poisoning from contaminated poultry?,Staphylococcus aureus,Salmonella enterica,Clostridium difficile,Escherichia coli,B
Which microorganism is responsible for causing Lyme disease?,Staphylococcus aureus,Streptococcus pyogenes,Escherichia coli,Borrelia burgdorferi,D
Name the microorganism commonly associated with causing gastroenteritis.,Streptococcus pneumoniae,Staphylococcus aureus,Norovirus,Escherichia coli,C
What is the causative agent of tuberculosis?,Mycobacterium tuberculosis,Staphylococcus aureus,Escherichia coli,Salmonella typhi,A
Which microorganism is commonly associated with causing meningitis in neonates?,Escherichia coli,Staphylococcus aureus,Streptococcus pyogenes,Group B Streptococcus (Streptococcus agalactiae),D
Name the microorganism responsible for causing healthcare-associated pneumonia.,Staphylococcus aureus,Klebsiella pneumoniae,Escherichia coli,Acinetobacter baumannii,A
What microorganism is commonly associated with causing dental caries (tooth decay)?,Streptococcus mutans,Escherichia coli,Haemophilus influenzae,Staphylococcus aureus,A
Which microorganism is responsible for causing Legionnaires' disease?,Staphylococcus aureus,Legionella pneumophila,Streptococcus pneumoniae,Escherichia coli,B
Name the microorganism commonly associated with causing urinary tract infections in sexually active women.,Staphylococcus aureus,Streptococcus pyogenes,Neisseria gonorrhoeae,Escherichia coli,D
What is the causative agent of malaria?,Escherichia coli,Plasmodium spp.,Staphylococcus aureus,Streptococcus pneumoniae,B
Which microorganism is commonly associated with causing dental abscesses?,Staphylococcus aureus,Escherichia coli,Streptococcus pneumoniae,Streptococcus intermedius,A
Name the microorganism responsible for causing whooping cough.,Streptococcus pyogenes,Staphylococcus aureus,Bordetella pertussis,Escherichia coli,C
What microorganism is commonly associated with causing infectious diarrhea in children?,Rotavirus,Staphylococcus aureus,Salmonella enterica,Escherichia coli,A
Which microorganism is responsible for causing candidiasis (oral thrush)?,Aspergillus fumigatus,Escherichia coli,Candida albicans,Staphylococcus aureus,C
Name the microorganism commonly associated with causing pneumonia in elderly individuals.,Staphylococcus aureus,Escherichia coli,Streptococcus pneumoniae,Klebsiella pneumoniae,C
What is the primary mode of transmission for the influenza virus?,Vector-borne,Respiratory droplets,Foodborne,Direct contact,B
Name the most effective way to prevent the spread of healthcare-associated infections.,Vaccination,Hand hygiene,Antibiotic prophylaxis,Isolation precautions,B
What is the recommended duration for surgical hand scrubbing?,At least 1 minute,At least 30 seconds,At least 2 minutes,At least 5 minutes,C
Which of the following is an example of a standard precaution in infection control?,Wearing gloves,Cleaning surfaces with disinfectant,Administering antibiotics,Using a sterile dressing,A
What is the term used to describe the process of killing or eliminating all microorganisms on a surface or object?,Sterilization,Decontamination,Isolation,Disinfection,D
Name the organization responsible for developing guidelines and recommendations for infection control practices in healthcare settings.,Centers for Disease Control and Prevention (CDC),Occupational Safety and Health Administration (OSHA),Food and Drug Administration (FDA),World Health Organization (WHO),A
What is the recommended minimum alcohol concentration for effective hand sanitizers?,90%,45%,30%,60%,D
Which of the following is an example of a healthcare-associated infection?,Tuberculosis,Surgical site infection,Common cold,Seasonal flu,B
Name the practice that aims to reduce the risk of transmission of infectious diseases from healthcare providers to patients.,Source control,Respiratory hygiene,Aseptic technique,Universal precautions,C
Which of the following is an example of a transmission-based precaution in infection control?,Contact precautions,Airborne precautions,Droplet precautions,All of the above,B
Name the process of physically separating patients with certain infectious diseases to prevent the spread of infection.,Quarantine,Isolation,Segregation,Exclusion,B
What is the recommended duration for hand hygiene using an alcohol-based hand sanitizer?,At least 30 seconds,At least 20 seconds,At least 5 seconds,At least 10 seconds,B
Which of the following is an example of personal protective equipment (PPE) used in infection control?,Gauze pads,Hemostats,Surgical scissors,Gloves,D
Name the system used to classify and categorize infectious agents based on their risk of causing disease in humans.,Standard precautions,Chain of infection,Infection prevention bundle,Biosafety level (BSL),D
What is the primary mode of transmission for the human immunodeficiency virus (HIV)?,Ingestion of contaminated food,Sexual contact,Vector-borne,Bloodborne exposure,B
Which of the following is an example of a healthcare-associated infection prevention measure?,Hand hygiene education for the general public,Isolation of patients with common cold,Immunization campaigns for community,Proper cleaning and disinfection of medical equipment,D
Name the device used to create a physical barrier between healthcare providers and patients during certain medical procedures.,Personal protective equipment (PPE),N95 respirator,Face shield,Surgical mask,A
What is the recommended method for hand drying after handwashing?,Using a hand dryer,Using disposable paper towels,Using a shared cloth towel,Using a clean cloth towel,B
Which of the following is an example of a vaccine-preventable infection?,Tuberculosis,Legionnaires' disease,Measles,Clostridium difficile infection,C
What is the leading cause of infectious diseases in Nigeria?,Tuberculosis,Cholera,HIV/AIDS,Malaria,D
Name the primary mode of transmission for Lassa fever in Nigeria.,Ingestion of contaminated food,Contact with infected rodents,Respiratory droplets,Sexual contact,B
What is the recommended first-line treatment for uncomplicated malaria in Nigeria?,Sulfadoxine-pyrimethamine (SP),Quinine,Chloroquine,Artemisinin-based combination therapy (ACT),D
Which of the following is a major challenge to infection control in Nigerian healthcare facilities?,Low patient volume,Strict adherence to guidelines,High vaccination coverage,Lack of adequate resources,D
Name the mosquito species responsible for transmitting malaria in Nigeria.,Chikungunya mosquitoes,Culex mosquitoes,Anopheles mosquitoes,Aedes mosquitoes,C
What is the recommended vaccination schedule for infants in Nigeria?,African Union (AU) schedule,United Nations (UN) schedule,National Programme on Immunization (NPI) schedule,World Health Organization (WHO) schedule,C
Which of the following is an effective method for preventing the spread of cholera in Nigerian communities?,Access to clean water and sanitation facilities,Mass administration of antibiotics,Use of insecticide-treated bed nets,Isolation of infected individuals,A
Name the government agency responsible for overseeing public health in Nigeria.,National Primary Health Care Development Agency (NPHCDA),Nigeria Centre for Disease Control (NCDC),National Agency for Food and Drug Administration and Control (NAFDAC),Federal Ministry of Health (FMOH),A
What is the recommended age for the administration of the measles vaccine in Nigeria?,6 weeks,9 months,2 years,1 year,B
Which of the following is a common practice for preventing the spread of infectious diseases in Nigerian households?,Food sharing among family members,Wearing face masks,Proper hand hygiene,Open defecation,C
Name the infection control measure that is crucial for preventing the transmission of Ebola virus in Nigeria.,Strict adherence to standard precautions,Isolation of infected individuals,Use of personal protective equipment (PPE),Disinfection of contaminated surfaces,A
Which of the following is a common vaccine-preventable disease in Nigeria?,Dengue fever,Typhoid fever,Polio,Yellow fever,C
What is the recommended duration for handwashing with soap and water in Nigerian healthcare settings?,At least 5 seconds,At least 2 minutes,At least 40-60 seconds,At least 10-20 seconds,C
Which of the following is a common vector-borne disease in Nigeria?,Malaria,Dengue fever,Tuberculosis,Cholera,A
Name the traditional cultural practice in Nigeria that may contribute to the spread of infectious diseases.,Female genital mutilation/cutting (FGM/C),Polygamy,Exclusive breastfeeding,Traditional herbal medicine,A
What is the recommended method for storing vaccines in Nigerian healthcare facilities?,Storing at room temperature,Avoiding refrigeration to prevent damage,Maintaining a cold chain system with appropriate temperature monitoring,Freezing at -20°C,C
Which of the following is a common healthcare-associated infection prevention strategy in Nigerian hospitals?,Regular fumigation of hospital wards,Infection prevention and control training for healthcare workers,Universal masking,Visitor restrictions,B
Name the zoonotic disease commonly found in Nigeria that is transmitted through the bites of infected ticks.,Rift Valley fever,Crimean-Congo hemorrhagic fever (CCHF),Avian influenza (bird flu),Brucellosis,B
Which disease is the leading cause of death in Nigeria?,HIV/AIDS,Malaria,Tuberculosis,Cholera,B
What is the recommended method for preventing the spread of HIV in Nigeria?,Correct and consistent use of condoms,Regular handwashing,Proper food hygiene,Isolation of infected individuals,A
Which of the following is a common vaccine-preventable disease in Nigeria?,Yellow fever,Typhoid fever,Polio,Dengue fever,C
Name the infection control measure that is crucial for preventing the transmission of tuberculosis in Nigeria.,Universal masking,Hand hygiene,Respiratory hygiene and cough etiquette,Proper food handling,C
What is the recommended method for safe disposal of used needles and sharps in Nigerian healthcare facilities?,Throwing them in regular trash bins,Placing them in puncture-proof sharps containers,Burning them in an open fire,Flushing them down the toilet,B
Which of the following is an effective method for preventing the spread of cholera in Nigerian communities?,Mass administration of antibiotics,Use of insecticide-treated bed nets,Isolation of infected individuals,Access to clean water and sanitation facilities,D
Name the government agency responsible for overseeing public health in Nigeria.,National Primary Health Care Development Agency (NPHCDA),National Agency for the Control of AIDS (NACA),Federal Ministry of Health (FMOH),Nigeria Centre for Disease Control (NCDC),D
What is the recommended age for the administration of the measles vaccine in Nigeria?,2 years,1 year,6 weeks,9 months,D
Which of the following is a common practice for preventing the spread of infectious diseases in Nigerian households?,Open defecation,Food sharing among family members,Proper hand hygiene,Wearing face masks,C
Name the infection control measure that is crucial for preventing the transmission of Ebola virus in Nigeria.,Disinfection of contaminated surfaces,Isolation of infected individuals,Use of personal protective equipment (PPE),Strict adherence to standard precautions,D
Which of the following is a common vaccine-preventable disease in Nigeria?,Dengue fever,Pneumococcal disease,Cholera,Tuberculosis,B
What is the recommended duration for handwashing with soap and water in Nigerian healthcare settings?,At least 2 minutes,At least 40-60 seconds,At least 10-20 seconds,At least 5 seconds,B
Which of the following is a common vector-borne disease in Nigeria?,Malaria,Tuberculosis,Dengue fever,Cholera,A
Name the traditional cultural practice in Nigeria that may contribute to the spread of infectious diseases.,Female genital mutilation/cutting (FGM/C),Exclusive breastfeeding,Polygamy,Traditional herbal medicine,A
What is the recommended method for storing vaccines in Nigerian healthcare facilities?,Storing at room temperature,Freezing at -20°C,Avoiding refrigeration to prevent damage,Maintaining a cold chain system with appropriate temperature monitoring,D
Which of the following is a common healthcare-associated infection prevention strategy in Nigerian hospitals?,Universal masking,Infection prevention and control training for healthcare workers,Visitor restrictions,Regular fumigation of hospital wards,B
Name the zoonotic disease commonly found in Nigeria that is transmitted through the bites of infected tsetse flies.,Rift Valley fever,Avian influenza (bird flu),Brucellosis,Sleeping sickness (African trypanosomiasis),D
What is a zoonotic disease?,A disease that only affects animals,A disease caused by bacteria,A disease caused by a virus,A disease that can be transmitted from animals to humans,D
Which of the following is an example of a zoonotic disease?,Diabetes,Rabies,Acne,Hypertension,B
What is the primary mode of transmission for zoonotic diseases?,Sexual transmission,Ingestion of contaminated food,Direct contact with infected animals,Inhalation of respiratory droplets,C
Which of the following is a zoonotic disease transmitted by rodents?,HIV/AIDS,Hantavirus pulmonary syndrome,Influenza,Ebola,B
Name the zoonotic disease caused by a bacterium that is commonly transmitted through contaminated food and water.,Salmonellosis,Influenza,Tuberculosis,Leptospirosis,A
Which of the following is a zoonotic disease transmitted through the bites of infected fleas?,Plague,Malaria,Hepatitis B,HIV/AIDS,A
Name the zoonotic disease caused by a virus that is primarily transmitted through the bite of infected ticks.,Dengue fever,Rabies,Lyme disease,West Nile fever,C
What is the term for diseases that can be transmitted between animals and humans?,Vector-borne diseases,Autoimmune diseases,Anthroponotic diseases,Zoonotic diseases,D
Which of the following is a zoonotic disease commonly transmitted through the consumption of undercooked meat?,Toxoplasmosis,Cholera,Malaria,Tuberculosis,A
Name the zoonotic disease caused by a bacterium commonly found in domestic animals and transmitted to humans through contact with animal urine.,Salmonellosis,Ebola,Leptospirosis,Hantavirus pulmonary syndrome,C
What is the recommended method for preventing zoonotic diseases transmitted by mosquitoes?,Eliminating mosquito breeding sites,Using insect repellent,All of the above,Using bed nets,B
Which of the following is a zoonotic disease commonly transmitted through the bite of infected ticks?,SARS-CoV-2,Influenza,Rabies,Lyme disease,D
Name the zoonotic disease caused by a virus that is primarily transmitted through contact with infected camels.,Lyme disease,Avian influenza (bird flu),Hantavirus pulmonary syndrome,Middle East respiratory syndrome (MERS),D
What is the term for diseases that can be transmitted from humans to animals?,Vector-borne diseases,Reverse zoonoses,Anthroponotic diseases,Zoonotic diseases,C
Which of the following is a zoonotic disease transmitted through the consumption of contaminated water or food?,Cryptosporidiosis,HIV/AIDS,Chikungunya,West Nile fever,A
Name the zoonotic disease caused by a parasite commonly found in cats and transmitted to humans through contact with cat feces.,Leptospirosis,Salmonellosis,Ebola,Toxoplasmosis,D
Which of the following is a zoonotic disease transmitted through the bites of infected mosquitoes?,Zika virus infection,Hepatitis C,Influenza,Rotavirus infection,A
What is the primary causative agent of tuberculosis?,Streptococcus pneumoniae,Mycobacterium tuberculosis,Escherichia coli,Mycobacterium leprae,B
Which of the following is associated with the production of exotoxins?,Salmonella enterica,Clostridium difficile,Staphylococcus aureus,Haemophilus influenzae,C
Name the fungal pathogen responsible for causing histoplasmosis.,Candida albicans,Histoplasma capsulatum,Aspergillus fumigatus,Pneumocystis jirovecii,B
What is the main mode of transmission of hepatitis A?,Sexual transmission,Fecal-oral route,Aerosol transmission,Blood transfusion,B
Which of the following is a characteristic feature of Chlamydia trachomatis infection?,Production of exotoxins,Invasion of host tissues,Obligate intracellular growth,Formation of biofilms,C
Name the protozoan parasite responsible for causing malaria.,Entamoeba histolytica,Toxoplasma gondii,Plasmodium falciparum,Giardia lamblia,C
What is the primary causative agent of Lyme disease?,Leptospira interrogans,Neisseria gonorrhoeae,Borrelia burgdorferi,Treponema pallidum,C
Which of the following is associated with the production of endotoxins?,Escherichia coli,Serratia marcescens,Staphylococcus aureus,Streptococcus pyogenes,A
Name the virus responsible for causing acquired immunodeficiency syndrome (AIDS).,Influenza virus,Herpes simplex virus,Varicella-zoster virus,Human immunodeficiency virus (HIV),D
What is the primary causative agent of cholera?,Salmonella enterica,Vibrio cholerae,Yersinia pestis,Shigella flexneri,B
Which of the following is a characteristic feature of Clostridium tetani infection?,Production of exotoxins,Invasion of host tissues,Formation of biofilms,Production of tetanospasmin toxin,D
Name the bacterial pathogen responsible for causing diphtheria.,Legionella pneumophila,Corynebacterium diphtheriae,Neisseria meningitidis,Streptococcus pyogenes,B
What is the main mode of transmission of hepatitis B?,Sexual transmission,Parenteral transmission,Blood transfusion,Fecal-oral route,B
Which of the following is a characteristic feature of Mycobacterium leprae infection?,Slow-growing organism,Formation of biofilms,Production of exotoxins,Invasion of host tissues,A
Name the fungus responsible for causing candidiasis (yeast infection).,Aspergillus fumigatus,Candida albicans,Pneumocystis jirovecii,Histoplasma capsulatum,B
What is the primary causative agent of syphilis?,Treponema pallidum,Haemophilus ducreyi,Chlamydia trachomatis,Neisseria gonorrhoeae,A
Which of the following is associated with the production of a heat-labile toxin?,Klebsiella pneumoniae,Staphylococcus aureus,Escherichia coli,Salmonella enterica,C
Name the bacteria responsible for causing Legionnaires' disease.,Pseudomonas aeruginosa,Streptococcus pneumoniae,Legionella pneumophila,Haemophilus influenzae,C
What is the main mode of transmission of hepatitis C?,Aerosol transmission,Sexual transmission,Blood transfusion,Parenteral transmission,D
Which of the following is a characteristic feature of Streptococcus pneumoniae infection?,Obligate intracellular growth,Formation of biofilms,Invasion of host tissues,Production of exotoxins,B
What is the term used to describe infectious diseases that have recently increased in incidence or geographic range?,Emerging infections,Chronic infections,Hereditary infections,Endemic infections,A
Which of the following is an example of an emerging viral infection?,Ebola virus disease,Tuberculosis,Syphilis,Malaria,A
Name the mosquito-borne viral infection that emerged in the Americas in 2015 and is associated with microcephaly in newborns.,Dengue fever,Malaria,Zika virus infection,Chikungunya,C
What is the process by which a pathogen adapts to a new host species?,Drug resistance,Host switching,Vector control,Immunity development,B
Which of the following is an example of a reemerging bacterial infection?,Cholera,Tuberculosis,Leprosy,Influenza,B
Name the respiratory virus that caused a global pandemic in 2009.,H1N1 influenza (swine flu),Ebola virus disease,Hepatitis C,HIV/AIDS,A
